company,gender,category,title,path,itemid
Uniqlo, Women, Outerwear,WOMEN Blocktech Coat,https://d15udtvdbbfasl.cloudfront.net/catalog/product/large_image/03_419914.jpg,0
Uniqlo, Women, Outerwear,WOMEN Denim Jacket,https://d15udtvdbbfasl.cloudfront.net/catalog/product/large_image/66_419929.jpg,1
Uniqlo, Women, Outerwear,WOMEN Corduroy Oversized Jacket,https://d15udtvdbbfasl.cloudfront.net/catalog/product/large_image/35_419930.jpg,2
Uniqlo, Women, Outerwear,WOMEN Ultra Light Down Jacket,https://d15udtvdbbfasl.cloudfront.net/catalog/product/large_image/09_418085.jpg,3
Uniqlo, Women, Outerwear,WOMEN Stretch Jacket,https://d15udtvdbbfasl.cloudfront.net/catalog/product/large_image/69_420166.jpg,4
Uniqlo, Women, Outerwear,WOMEN Double Face Cocoon Coat,https://d15udtvdbbfasl.cloudfront.net/catalog/product/large_image/02_420228.jpg,5
Uniqlo, Women, Outerwear,WOMEN Ultra Light Down Compact Jacket,https://d15udtvdbbfasl.cloudfront.net/catalog/product/large_image/10_419779.jpg,6
Uniqlo, Women, Outerwear,WOMEN Cotton Ribbed Blouson,https://d15udtvdbbfasl.cloudfront.net/catalog/product/large_image/01_419931.jpg,7
Uniqlo, Women, Outerwear,WOMEN Ultra Light Down Vest,https://d15udtvdbbfasl.cloudfront.net/catalog/product/large_image/01_419775.jpg,8
Uniqlo, Women, Outerwear,WOMEN Double Face Hooded Coat,https://d15udtvdbbfasl.cloudfront.net/catalog/product/large_image/03_420227.jpg,9
Uniqlo, Women, Outerwear,WOMEN Ultra Light Down Compact Vest,https://d15udtvdbbfasl.cloudfront.net/catalog/product/large_image/18_419778.jpg,10
Uniqlo, Women, Outerwear,WOMEN Ultra Light Down Jacket,https://d15udtvdbbfasl.cloudfront.net/catalog/product/large_image/01_419776.jpg,11
Uniqlo, Women, Outerwear,WOMEN Ultra Light Down Jacket,https://d15udtvdbbfasl.cloudfront.net/catalog/product/large_image/69_409112.jpg,12
Uniqlo, Women, Outerwear,WOMEN Sweat Long Sleeve Full-Zip Hoodie,https://d15udtvdbbfasl.cloudfront.net/catalog/product/large_image/06_413677.jpg,13
Uniqlo, Women, Outerwear,WOMEN Sweat Long Sleeve Full-Zip Hoodie,https://d15udtvdbbfasl.cloudfront.net/catalog/product/large_image/10_413677.jpg,14
Uniqlo, Women, Outerwear,WOMEN Keith Haring Long Sleeve Sweatshirt,https://d15udtvdbbfasl.cloudfront.net/catalog/product/large_image/02_422311.jpg,15
Uniqlo, Women, Outerwear,WOMEN 3D Cotton Dolman Half Sleeve Sweater,https://d15udtvdbbfasl.cloudfront.net/catalog/product/large_image/47_422771.jpg,16
Uniqlo, Women, Outerwear,WOMEN UV Cut Supima Cotton Crew Neck Cardigan,https://d15udtvdbbfasl.cloudfront.net/catalog/product/large_image/41_417402.jpg,17
Uniqlo, Women, Outerwear,WOMEN Extra Fine Merino V Neck Long Cardigan,https://d15udtvdbbfasl.cloudfront.net/catalog/product/large_image/69_421711.jpg,18
Uniqlo, Women, Outerwear,WOMEN AIRism UV Cut Seamless Stole Cardigan,https://d15udtvdbbfasl.cloudfront.net/catalog/product/large_image/68_421356.jpg,19
Uniqlo, Women, Outerwear,WOMEN Extra Fine Merino Crew Neck Sweater,https://d15udtvdbbfasl.cloudfront.net/catalog/product/large_image/58_418668.jpg,20
Uniqlo, Women, Outerwear,WOMEN Keith Haring Long Sleeve Sweatshirt,https://d15udtvdbbfasl.cloudfront.net/catalog/product/large_image/00_420606.jpg,21
Uniqlo, Women, Outerwear,WOMEN Oversized Round Neck Short Sleeve Sweater,https://d15udtvdbbfasl.cloudfront.net/catalog/product/large_image/02_418663.jpg,22
Uniqlo, Women, Outerwear,WOMEN Extra Fine Merino Crew Neck Cardigan,https://d15udtvdbbfasl.cloudfront.net/catalog/product/large_image/10_418666.jpg,23
Uniqlo, Women, Outerwear,WOMEN Extra Fine Merino Relaxed V Neck Sweater,https://d15udtvdbbfasl.cloudfront.net/catalog/product/large_image/16_421710.jpg,24
Uniqlo, Women, Outerwear,WOMEN Extra Fine Merino Crew Neck Half Sleeve Sweater,https://d15udtvdbbfasl.cloudfront.net/catalog/product/large_image/01_420901.jpg,25
Uniqlo, Women, Outerwear,WOMEN 3D Cotton Cocoon 3/4 Sleeve Sweater,https://d15udtvdbbfasl.cloudfront.net/catalog/product/large_image/31_421925.jpg,26
Uniqlo, Women, Outerwear,WOMEN Keith Haring Long Sleeve Sweatshirt,https://d15udtvdbbfasl.cloudfront.net/catalog/product/large_image/11_422312.jpg,27
Uniqlo, Women, Outerwear,WOMEN Sweat Mock Neck Long Sleeve Long Pullover,https://d15udtvdbbfasl.cloudfront.net/catalog/product/large_image/25_419975.jpg,28
Uniqlo, Women, Outerwear,WOMEN Keith Haring Long Sleeve Sweatshirt,https://d15udtvdbbfasl.cloudfront.net/catalog/product/large_image/09_422265.jpg,29
Uniqlo, Women, Outerwear,WOMEN Blocktech Parka,https://d15udtvdbbfasl.cloudfront.net/catalog/product/large_image/12_419913.jpg,30
Uniqlo, Women, Outerwear,WOMEN Oversized Parka,https://d15udtvdbbfasl.cloudfront.net/catalog/product/large_image/58_419932.jpg,31
Uniqlo, Women, Outerwear,WOMEN Reversible Parka,https://d15udtvdbbfasl.cloudfront.net/catalog/product/large_image/47_420262.jpg,32
Uniqlo, Women, Outerwear,WOMEN AIRism UV Cut Long Sleeve Mesh Hoodie,https://d15udtvdbbfasl.cloudfront.net/catalog/product/large_image/02_421355.jpg,33
Uniqlo, Women, Outerwear,WOMEN Pocketable UV Cut Parka,https://d15udtvdbbfasl.cloudfront.net/catalog/product/large_image/12_419912.jpg,34
Uniqlo, Women, Outerwear,WOMEN Ultra Light Down Parka,https://d15udtvdbbfasl.cloudfront.net/catalog/product/large_image/12_419777.jpg,35
Uniqlo, Women, Outerwear,WOMEN Sweat Long Sleeve Full-Zip Hoodie,https://d15udtvdbbfasl.cloudfront.net/catalog/product/large_image/59_418237.jpg,36
Uniqlo, Women, Outerwear,WOMEN Sweat Cropped Pullover Hoodie,https://d15udtvdbbfasl.cloudfront.net/catalog/product/large_image/01_418236.jpg,37
Uniqlo, Women, Outerwear,WOMEN Sweat Hoodie Long Sleeve Dress,https://d15udtvdbbfasl.cloudfront.net/catalog/product/large_image/09_420551.jpg,38
Uniqlo, Women, Outerwear,WOMEN Sweat Pants,https://d15udtvdbbfasl.cloudfront.net/catalog/product/large_image/06_418248.jpg,39
Uniqlo, Women, Tops,WOMEN Linen Blend Short Sleeve Blouse,https://d15udtvdbbfasl.cloudfront.net/catalog/product/large_image/68_414174.jpg,40
Uniqlo, Women, Tops,WOMEN Rayon Sleeveless Blouse,https://d15udtvdbbfasl.cloudfront.net/catalog/product/large_image/32_418467.jpg,41
Uniqlo, Women, Tops,WOMEN Linen Blend Stand Collar 3/4 Sleeve Blouse,https://d15udtvdbbfasl.cloudfront.net/catalog/product/large_image/00_415678.jpg,42
Uniqlo, Women, Tops,WOMEN Flannel Checked Long Sleeve Shirt,https://d15udtvdbbfasl.cloudfront.net/catalog/product/large_image/69_421605.jpg,43
Uniqlo, Women, Tops,WOMEN Printed Sleeveless Blouse,https://d15udtvdbbfasl.cloudfront.net/catalog/product/large_image/24_421724.jpg,44
Uniqlo, Women, Tops,WOMEN Flannel Checked Long Sleeve Shirt,https://d15udtvdbbfasl.cloudfront.net/catalog/product/large_image/10_421607.jpg,45
Uniqlo, Women, Tops,WOMEN Drape Mock Neck Half Sleeve Blouse,https://d15udtvdbbfasl.cloudfront.net/catalog/product/large_image/68_418397.jpg,46
Uniqlo, Women, Tops,WOMEN Flannel Checked Skipper Collar Long Sleeve Shirt,https://d15udtvdbbfasl.cloudfront.net/catalog/product/large_image/69_421715.jpg,47
Uniqlo, Women, Tops,WOMEN Supima Cotton Stretch Long Sleeve Shirt,https://d15udtvdbbfasl.cloudfront.net/catalog/product/large_image/00_418409.jpg,48
Uniqlo, Women, Tops,WOMEN Drape 3/4 Sleeve Blouse,https://d15udtvdbbfasl.cloudfront.net/catalog/product/large_image/10_418398.jpg,49
Uniqlo, Women, Tops,WOMEN Drape Short Sleeve Blouse,https://d15udtvdbbfasl.cloudfront.net/catalog/product/large_image/25_414145.jpg,50
Uniqlo, Women, Tops,WOMEN Flannel Checked Skipper Collar Long Sleeve Shirt,https://d15udtvdbbfasl.cloudfront.net/catalog/product/large_image/01_419770.jpg,51
Uniqlo, Women, Tops,WOMEN Rayon Short Sleeve Blouse,https://d15udtvdbbfasl.cloudfront.net/catalog/product/large_image/13_414141.jpg,52
Uniqlo, Women, Tops,WOMEN Soft Cotton Printed Short Sleeve Shirt,https://d15udtvdbbfasl.cloudfront.net/catalog/product/large_image/69_418463.jpg,53
Uniqlo, Women, Tops,WOMEN Extra Fine Cotton V Neck Striped Long Sleeve Shirt,https://d15udtvdbbfasl.cloudfront.net/catalog/product/large_image/66_421517.jpg,54
Uniqlo, Women, Tops,WOMEN Studio Sanderson for UNIQLO Soft Cotton Shirt,https://d15udtvdbbfasl.cloudfront.net/catalog/product/large_image/69_416358.jpg,55
Uniqlo, Women, Tops,WOMEN Flannel Checked Skipper Collar Long Sleeve Shirt,https://d15udtvdbbfasl.cloudfront.net/catalog/product/large_image/17_421714.jpg,56
Uniqlo, Women, Tops,WOMEN Rayon Long Sleeve Blouse,https://d15udtvdbbfasl.cloudfront.net/catalog/product/large_image/16_415977.jpg,57
Uniqlo, Women, Tops,WOMEN Supima Cotton Stretch Striped Long Sleeve Shirt,https://d15udtvdbbfasl.cloudfront.net/catalog/product/large_image/61_421417.jpg,58
Uniqlo, Women, Tops,WOMEN Rayon Long Sleeve Blouse,https://d15udtvdbbfasl.cloudfront.net/catalog/product/large_image/25_418394.jpg,59
Uniqlo, Women, Tops,WOMEN Soft Cotton Short Sleeve Shirt,https://d15udtvdbbfasl.cloudfront.net/catalog/product/large_image/65_414167.jpg,60
Uniqlo, Women, Tops,WOMEN Rayon Stand Collar 3/4 Sleeve Blouse,https://d15udtvdbbfasl.cloudfront.net/catalog/product/large_image/00_418395.jpg,61
Uniqlo, Women, Tops,WOMEN Drape Sleeveless Blouse,https://d15udtvdbbfasl.cloudfront.net/catalog/product/large_image/12_418466.jpg,62
Uniqlo, Women, Tops,WOMEN Flannel Checked Skipper Collar Long Sleeve Shirt,https://d15udtvdbbfasl.cloudfront.net/catalog/product/large_image/32_421610.jpg,63
Uniqlo, Women, Tops,WOMEN Rayon V Neck Long Sleeve Blouse,https://d15udtvdbbfasl.cloudfront.net/catalog/product/large_image/69_418414.jpg,64
Uniqlo, Women, Tops,WOMEN Extra Fine Cotton V Neck Long Sleeve Shirt,https://d15udtvdbbfasl.cloudfront.net/catalog/product/large_image/32_418418.jpg,65
Uniqlo, Women, Tops,WOMEN Printed Sleeveless Blouse,https://d15udtvdbbfasl.cloudfront.net/catalog/product/large_image/00_419772.jpg,66
Uniqlo, Women, Tops,WOMEN Extra Fine Cotton Oversized Striped Long Sleeve Shirt,https://d15udtvdbbfasl.cloudfront.net/catalog/product/large_image/63_421516.jpg,67
Uniqlo, Women, Tops,WOMEN Rayon Sleeveless Blouse,https://d15udtvdbbfasl.cloudfront.net/catalog/product/large_image/00_414142.jpg,68
Uniqlo, Women, Tops,WOMEN Printed 3/4 Sleeve Blouse,https://d15udtvdbbfasl.cloudfront.net/catalog/product/large_image/59_418421.jpg,69
Uniqlo, Women, Tops,WOMEN Extra Fine Cotton Oversized Long Sleeve Shirt,https://d15udtvdbbfasl.cloudfront.net/catalog/product/large_image/60_418415.jpg,70
Uniqlo, Women, Tops,WOMEN Extra Fine Cotton Relaxed Collarless Short Sleeve Shirt,https://d15udtvdbbfasl.cloudfront.net/catalog/product/large_image/69_420718.jpg,71
Uniqlo, Women, Tops,WOMEN Rayon Striped Long Sleeve Blouse,https://d15udtvdbbfasl.cloudfront.net/catalog/product/large_image/69_418411.jpg,72
Uniqlo, Women, Tops,WOMEN Flannel Checked Long Sleeve Shirt,https://d15udtvdbbfasl.cloudfront.net/catalog/product/large_image/53_421604.jpg,73
Uniqlo, Women, Tops,WOMEN Flannel Checked Long Sleeve Shirt,https://d15udtvdbbfasl.cloudfront.net/catalog/product/large_image/13_421602.jpg,74
Uniqlo, Women, Tops,WOMEN Flannel Checked Long Sleeve Shirt,https://d15udtvdbbfasl.cloudfront.net/catalog/product/large_image/05_421609.jpg,75
Uniqlo, Women, Tops,WOMEN Rayon Skipper Collar 3/4 Sleeve Blouse,https://d15udtvdbbfasl.cloudfront.net/catalog/product/large_image/69_422596.jpg,76
Uniqlo, Women, Tops,WOMEN Rayon Long Sleeve Blouse,https://d15udtvdbbfasl.cloudfront.net/catalog/product/large_image/01_410002.jpg,77
Uniqlo, Women, Tops,WOMEN Rayon Short Sleeve Blouse,https://d15udtvdbbfasl.cloudfront.net/catalog/product/large_image/41_414141.jpg,78
Uniqlo, Women, Tops,WOMEN Drape V Neck Short Sleeve Blouse,https://d15udtvdbbfasl.cloudfront.net/catalog/product/large_image/55_418399.jpg,79
Uniqlo, Women, Tops,WOMEN Rayon Short Sleeve Blouse,https://d15udtvdbbfasl.cloudfront.net/catalog/product/large_image/26_419760.jpg,80
Uniqlo, Women, Tops,WOMEN Supima Cotton Stretch Long Sleeve Shirt,https://d15udtvdbbfasl.cloudfront.net/catalog/product/large_image/00_414148.jpg,81
Uniqlo, Women, Tops,WOMEN Soft Cotton Short Sleeve Blouse,https://d15udtvdbbfasl.cloudfront.net/catalog/product/large_image/56_418464.jpg,82
Uniqlo, Women, Tops,WOMEN Drape French Sleeve Tunic,https://d15udtvdbbfasl.cloudfront.net/catalog/product/large_image/01_420389.jpg,83
Uniqlo, Women, Tops,WOMEN Flannel Checked Long Sleeve Shirt,https://d15udtvdbbfasl.cloudfront.net/catalog/product/large_image/66_421606.jpg,84
Uniqlo, Women, Tops,WOMEN Uniqlo U Relax Fit Crew Neck Short Sleeve T-Shirt,https://d15udtvdbbfasl.cloudfront.net/catalog/product/large_image/02_415793.jpg,85
Uniqlo, Women, Tops,WOMEN Striped 3/4 Sleeve T-Shirt,https://d15udtvdbbfasl.cloudfront.net/catalog/product/large_image/01_418262.jpg,86
Uniqlo, Women, Tops,WOMEN Uniqlo U Crew Neck Short Sleeve T-Shirt,https://d15udtvdbbfasl.cloudfront.net/catalog/product/large_image/44_421301.jpg,87
Uniqlo, Women, Tops,WOMEN Uniqlo U Oversized Square Half Sleeve T-Shirt,https://d15udtvdbbfasl.cloudfront.net/catalog/product/large_image/01_415797.jpg,88
Uniqlo, Women, Tops,WOMEN Ribbed Boxy Short Sleeve T-Shirt,https://d15udtvdbbfasl.cloudfront.net/catalog/product/large_image/59_418305.jpg,89
Uniqlo, Women, Tops,WOMEN Drape Crew Neck Short Sleeve T-Shirt,https://d15udtvdbbfasl.cloudfront.net/catalog/product/large_image/54_420145.jpg,90
Uniqlo, Women, Tops,WOMEN Waffle Sleeveless T-Shirt,https://d15udtvdbbfasl.cloudfront.net/catalog/product/large_image/21_417088.jpg,91
Uniqlo, Women, Tops,WOMEN Lace Combination Short Sleeve T-Shirt,https://d15udtvdbbfasl.cloudfront.net/catalog/product/large_image/56_418946.jpg,92
Uniqlo, Women, Tops,WOMEN Waffle Crew Neck Short Sleeve T-Shirt,https://d15udtvdbbfasl.cloudfront.net/catalog/product/large_image/36_420143.jpg,93
Uniqlo, Women, Tops,WOMEN Boyfriend Short Sleeve Tunic,https://d15udtvdbbfasl.cloudfront.net/catalog/product/large_image/14_413676.jpg,94
Uniqlo, Women, Tops,WOMEN Cropped Crew Neck Short Sleeve T-Shirt,https://d15udtvdbbfasl.cloudfront.net/catalog/product/large_image/46_420142.jpg,95
Uniqlo, Women, Tops,WOMEN 3D Cotton Dolman Half Sleeve Sweater,https://d15udtvdbbfasl.cloudfront.net/catalog/product/large_image/47_422771.jpg,96
Uniqlo, Women, Tops,WOMEN Uniqlo U Crew Neck Short Sleeve T-Shirt,https://d15udtvdbbfasl.cloudfront.net/catalog/product/large_image/02_414443.jpg,97
Uniqlo, Women, Tops,WOMEN Ribbed Boat Neck Half Sleeve T-Shirt,https://d15udtvdbbfasl.cloudfront.net/catalog/product/large_image/32_419972.jpg,98
Uniqlo, Women, Tops,WOMEN Mercerized Cotton Short Sleeve T-Shirt,https://d15udtvdbbfasl.cloudfront.net/catalog/product/large_image/25_418303.jpg,99
Uniqlo, Women, Tops,WOMEN Cotton Relax Fit Crew Neck Long Sleeve T-Shirt,https://d15udtvdbbfasl.cloudfront.net/catalog/product/large_image/02_419974.jpg,100
Uniqlo, Women, Tops,WOMEN Cotton Oversized Short Sleeve Tunic,https://d15udtvdbbfasl.cloudfront.net/catalog/product/large_image/25_422751.jpg,101
Uniqlo, Women, Tops,WOMEN Sweat Mock Neck Long Sleeve Long Pullover,https://d15udtvdbbfasl.cloudfront.net/catalog/product/large_image/25_419975.jpg,102
Uniqlo, Women, Tops,WOMEN Mercerized Cotton Gather Half Sleeve T-Shirt,https://d15udtvdbbfasl.cloudfront.net/catalog/product/large_image/32_420154.jpg,103
Uniqlo, Women, Tops,WOMEN Cotton Ribbed Crew Neck Long Sleeve T-Shirt,https://d15udtvdbbfasl.cloudfront.net/catalog/product/large_image/09_419693.jpg,104
Uniqlo, Women, Tops,WOMEN AIRism Camisole,https://d15udtvdbbfasl.cloudfront.net/catalog/product/large_image/00_404433.jpg,105
Uniqlo, Women, Tops,WOMEN EPICE DESIGN Half Sleeve Tunic,https://d15udtvdbbfasl.cloudfront.net/catalog/product/large_image/01_421974.jpg,106
Uniqlo, Women, Tops,WOMEN DRY-EX Crew Neck Short Sleeve T-Shirt,https://d15udtvdbbfasl.cloudfront.net/catalog/product/large_image/08_421079.jpg,107
Uniqlo, Women, Tops,WOMEN AIRism Scoop Neck Short Sleeve T-Shirt,https://d15udtvdbbfasl.cloudfront.net/catalog/product/large_image/00_404435.jpg,108
Uniqlo, Women, Tops,WOMEN Drape Crew Neck Short Sleeve T-Shirt,https://d15udtvdbbfasl.cloudfront.net/catalog/product/large_image/12_413696.jpg,109
Uniqlo, Women, Tops,WOMEN AIRism Seamless Short Sleeve Long T-Shirt,https://d15udtvdbbfasl.cloudfront.net/catalog/product/large_image/72_423081.jpg,110
Uniqlo, Women, Tops,WOMEN EPICE DESIGN Half Sleeve Tunic,https://d15udtvdbbfasl.cloudfront.net/catalog/product/large_image/35_42060400020.jpg,111
Uniqlo, Women, Tops,WOMEN Mercerized Cotton Short Sleeve T-Shirt,https://d15udtvdbbfasl.cloudfront.net/catalog/product/large_image/46_414445.jpg,112
Uniqlo, Women, Tops,WOMEN Striped Cropped Crew Neck Short Sleeve T-Shirt,https://d15udtvdbbfasl.cloudfront.net/catalog/product/large_image/17_420147.jpg,113
Uniqlo, Women, Tops,WOMEN EPICE DESIGN Half Sleeve Tunic,https://d15udtvdbbfasl.cloudfront.net/catalog/product/large_image/69_42197400020.jpg,114
Uniqlo, Women, Tops,WOMEN AIRism Sleeveless Top,https://d15udtvdbbfasl.cloudfront.net/catalog/product/large_image/00_404434.jpg,115
Uniqlo, Women, Tops,WOMEN Mercerized Cotton Volume Sleeve 3/4 Sleeve T-Shirt,https://d15udtvdbbfasl.cloudfront.net/catalog/product/large_image/59_418299.jpg,116
Uniqlo, Women, Tops,WOMEN DRY-EX Printed Short Sleeve Crew Neck T-Shirt,https://d15udtvdbbfasl.cloudfront.net/catalog/product/large_image/10_422656.jpg,117
Uniqlo, Women, Tops,WOMEN Waffle Crew Neck Short Sleeve T-Shirt,https://d15udtvdbbfasl.cloudfront.net/catalog/product/large_image/69_415632.jpg,118
Uniqlo, Women, Tops,WOMEN Mercerized Cotton V Neck Flare Short Sleeve T-Shirt,https://d15udtvdbbfasl.cloudfront.net/catalog/product/large_image/03_419697.jpg,119
Uniqlo, Women, Tops,WOMEN DRY-EX Crew Neck Short Sleeve T-Shirt,https://d15udtvdbbfasl.cloudfront.net/catalog/product/large_image/00_413839.jpg,120
Uniqlo, Women, Tops,WOMEN EPICE DESIGN Half Sleeve Tunic,https://d15udtvdbbfasl.cloudfront.net/catalog/product/large_image/02_420604.jpg,121
Uniqlo, Women, Tops,WOMEN HEATTECH Extra Warm Scoop Neck T-Shirt,https://d15udtvdbbfasl.cloudfront.net/catalog/product/large_image/01_408241.jpg,122
Uniqlo, Women, Tops,WOMEN Striped Boat Neck Long Sleeve T-Shirt,https://d15udtvdbbfasl.cloudfront.net/catalog/product/large_image/09_418230.jpg,123
Uniqlo, Women, Tops,WOMEN 1*1 Ribbed Cotton High Neck Half Sleeve T-Shirt,https://d15udtvdbbfasl.cloudfront.net/catalog/product/large_image/12_418228.jpg,124
Uniqlo, Women, Tops,WOMEN 3D Cotton Cocoon 3/4 Sleeve Sweater,https://d15udtvdbbfasl.cloudfront.net/catalog/product/large_image/31_421925.jpg,125
Uniqlo, Women, Tops,WOMEN Waffle Crew Neck 3/4 Sleeve T-Shirt,https://d15udtvdbbfasl.cloudfront.net/catalog/product/large_image/11_418234.jpg,126
Uniqlo, Women, Tops,WOMEN 1*1 Ribbed Cotton Crew Neck Long Sleeve T-Shirt,https://d15udtvdbbfasl.cloudfront.net/catalog/product/large_image/76_418225.jpg,127
Uniqlo, Women, Tops,The Brands Bicycle UT BMC (Short Sleeve Graphic T-Shirt),https://d15udtvdbbfasl.cloudfront.net/catalog/product/large_image/00_419303.jpg,128
Uniqlo, Women, Tops,WOMEN SANRIO Characters UT (Short Sleeve Graphic T-Shirt),https://d15udtvdbbfasl.cloudfront.net/catalog/product/large_image/00_417273.jpg,129
Uniqlo, Women, Tops,MARVEL x JASON POLAN UT (Short Sleeve Graphic T-Shirt),https://d15udtvdbbfasl.cloudfront.net/catalog/product/large_image/09_418314.jpg,130
Uniqlo, Women, Tops,WOMEN SUPER MARIO FAMILY MUSEUM UT (Short Sleeve Graphic T-Shirt),https://d15udtvdbbfasl.cloudfront.net/catalog/product/large_image/00_420005.jpg,131
Uniqlo, Women, Tops,Splatoon UT (Short Sleeve Graphic T-Shirt),https://d15udtvdbbfasl.cloudfront.net/catalog/product/large_image/09_41785200020.jpg,132
Uniqlo, Women, Tops,WOMEN Manga UT Urusei Yatsura (Short Sleeve Graphic T-Shirt),https://d15udtvdbbfasl.cloudfront.net/catalog/product/large_image/71_421667.jpg,133
Uniqlo, Women, Tops,Manga UT Kuroko’s Basketball (Short Sleeve Graphic T-Shirt),https://d15udtvdbbfasl.cloudfront.net/catalog/product/large_image/00_421454.jpg,134
Uniqlo, Women, Tops,The Brands Feat. Fender UT (Short Sleeve Graphic T-Shirt),https://d15udtvdbbfasl.cloudfront.net/catalog/product/large_image/09_419307.jpg,135
Uniqlo, Women, Tops,WOMEN Scandinavian UT (Short Sleeve Graphic T-Shirt),https://d15udtvdbbfasl.cloudfront.net/catalog/product/large_image/49_419528.jpg,136
Uniqlo, Women, Tops,WOMEN MICKEY ART UT (Short Sleeve Graphic T-Shirt),https://d15udtvdbbfasl.cloudfront.net/catalog/product/large_image/00_421281.jpg,137
Uniqlo, Women, Tops,Manga UT GINTAMA (Short Sleeve Graphic T-Shirt),https://d15udtvdbbfasl.cloudfront.net/catalog/product/large_image/07_421518.jpg,138
Uniqlo, Women, Tops,ONE PIECE UT (Short Sleeve Graphic T-Shirt),https://d15udtvdbbfasl.cloudfront.net/catalog/product/large_image/09_421670.jpg,139
Uniqlo, Women, Tops,WOMEN The Lion King UT (Short Sleeve Graphic T-Shirt),https://d15udtvdbbfasl.cloudfront.net/catalog/product/large_image/09_420620.jpg,140
Uniqlo, Women, Tops,Mickey Stands UT Pocket (Short Sleeve Graphic T-Shirt),https://d15udtvdbbfasl.cloudfront.net/catalog/product/large_image/66_416156.jpg,141
Uniqlo, Women, Tops,The Brands Hawaiian Loco UT LION (Short Sleeve Graphic T-Shirt),https://d15udtvdbbfasl.cloudfront.net/catalog/product/large_image/00_419467.jpg,142
Uniqlo, Women, Tops,Manga UT Kuroko’s Basketball (Short Sleeve Graphic T-Shirt),https://d15udtvdbbfasl.cloudfront.net/catalog/product/large_image/09_419396.jpg,143
Uniqlo, Women, Tops,ONE PIECE UT (Short Sleeve Graphic T-Shirt),https://d15udtvdbbfasl.cloudfront.net/catalog/product/large_image/54_421669.jpg,144
Uniqlo, Women, Tops,MEN UTGP POKEMON UT (Short Sleeve Graphic T-Shirt),https://d15udtvdbbfasl.cloudfront.net/catalog/product/large_image/69_422048.jpg,145
Uniqlo, Women, Tops,WOMEN SANRIO Characters UT (Short Sleeve Graphic T-Shirt),https://d15udtvdbbfasl.cloudfront.net/catalog/product/large_image/42_41727300020.jpg,146
Uniqlo, Women, Tops,WOMEN SUPER MARIO FAMILY MUSEUM UT (Short Sleeve Graphic T-Shirt),https://d15udtvdbbfasl.cloudfront.net/catalog/product/large_image/09_420007.jpg,147
Uniqlo, Women, Tops,WOMEN MICKEY ART UT (Short Sleeve Graphic T-Shirt),https://d15udtvdbbfasl.cloudfront.net/catalog/product/large_image/09_421280.jpg,148
Uniqlo, Women, Tops,WOMEN The Brands Hawaiian Loco UT (Short Sleeve Graphic T-Shirt),https://d15udtvdbbfasl.cloudfront.net/catalog/product/large_image/00_419297.jpg,149
Uniqlo, Women, Tops,Blizzard UT (Short Sleeve Graphic T-Shirt),https://d15udtvdbbfasl.cloudfront.net/catalog/product/large_image/00_419540.jpg,150
Uniqlo, Women, Tops,The game by STREET FIGHTER UT (Short Sleeve Graphic T-Shirt),https://d15udtvdbbfasl.cloudfront.net/catalog/product/large_image/00_417272.jpg,151
Uniqlo, Women, Tops,WOMEN R.A.By Verdy Half Sleeve UT (Graphic T-Shirt),https://d15udtvdbbfasl.cloudfront.net/catalog/product/large_image/15_422255.jpg,152
Uniqlo, Women, Tops,BT21 UT (Short Sleeve Graphic T-Shirt),https://d15udtvdbbfasl.cloudfront.net/catalog/product/large_image/11_417662.jpg,153
Uniqlo, Women, Tops,WOMEN Scandinavian UT (Short Sleeve Graphic T-Shirt),https://d15udtvdbbfasl.cloudfront.net/catalog/product/large_image/43_419526.jpg,154
Uniqlo, Women, Tops,MEN The Game By Monster Hunter UT (Short Sleeve Graphic T-Shirt),https://d15udtvdbbfasl.cloudfront.net/catalog/product/large_image/00_414338.jpg,155
Uniqlo, Women, Tops,ONE PIECE UT (Short Sleeve Graphic T-Shirt),https://d15udtvdbbfasl.cloudfront.net/catalog/product/large_image/03_421671.jpg,156
Uniqlo, Women, Tops,KAWS UT (Short Sleeve Graphic T-Shirt),https://d15udtvdbbfasl.cloudfront.net/catalog/product/large_image/00_422024.jpg,157
Uniqlo, Women, Tops,WOMEN The Lion King UT (Short Sleeve Graphic T-Shirt),https://d15udtvdbbfasl.cloudfront.net/catalog/product/large_image/30_42062000020.jpg,158
Uniqlo, Women, Tops,BT21 UT (Short Sleeve Graphic T-Shirt),https://d15udtvdbbfasl.cloudfront.net/catalog/product/large_image/13_417958.jpg,159
Uniqlo, Women, Tops,The Brands Feat. Volkswagen UT (Short Sleeve Graphic T-Shirt),https://d15udtvdbbfasl.cloudfront.net/catalog/product/large_image/09_416444.jpg,160
Uniqlo, Women, Tops,Manga UT HAIKYU!! (Short Sleeve Graphic T-Shirt),https://d15udtvdbbfasl.cloudfront.net/catalog/product/large_image/00_419397.jpg,161
Uniqlo, Women, Tops,HOKUSAI BLUE UT (Short Sleeve Graphic T-Shirt),https://d15udtvdbbfasl.cloudfront.net/catalog/product/large_image/69_41769300020.jpg,162
Uniqlo, Women, Tops,WOMEN SUPER MARIO FAMILY MUSEUM UT (Short Sleeve Graphic T-Shirt),https://d15udtvdbbfasl.cloudfront.net/catalog/product/large_image/03_420008.jpg,163
Uniqlo, Women, Tops,WOMEN MICKEY ART UT (Short Sleeve Graphic T-Shirt),https://d15udtvdbbfasl.cloudfront.net/catalog/product/large_image/00_419523.jpg,164
Uniqlo, Women, Tops,Blizzard UT (Short Sleeve Graphic T-Shirt),https://d15udtvdbbfasl.cloudfront.net/catalog/product/large_image/00_421461.jpg,165
Uniqlo, Women, Tops,The game by STREET FIGHTER UT (Short Sleeve Graphic T-Shirt),https://d15udtvdbbfasl.cloudfront.net/catalog/product/large_image/09_41727200020.jpg,166
Uniqlo, Women, Tops,WOMEN SANRIO Characters UT (Short Sleeve Graphic T-Shirt),https://d15udtvdbbfasl.cloudfront.net/catalog/product/large_image/00_420614.jpg,167
Uniqlo, Women, Tops,WOMEN R.A.By Verdy Half Sleeve UT (Graphic T-Shirt),https://d15udtvdbbfasl.cloudfront.net/catalog/product/large_image/00_423144.jpg,168
Uniqlo, Women, Tops,BT21 UT (Short Sleeve Graphic T-Shirt),https://d15udtvdbbfasl.cloudfront.net/catalog/product/large_image/03_417663.jpg,169
Uniqlo, Women, Tops,WOMEN SPRZ NY UT Keith Haring (Short Sleeve Graphic T-Shirt),https://d15udtvdbbfasl.cloudfront.net/catalog/product/large_image/00_418027.jpg,170
Uniqlo, Women, Tops,WOMEN MICKEY ART UT (Short Sleeve Graphic T-Shirt),https://d15udtvdbbfasl.cloudfront.net/catalog/product/large_image/00_414501.jpg,171
Uniqlo, Women, Tops,BABIES TODDLER PIXAR Vacation UT (Short Sleeve Graphic T-Shirt),https://d15udtvdbbfasl.cloudfront.net/catalog/product/large_image/00_418659.jpg,172
Uniqlo, Women, Tops,The game by STREET FIGHTER UT (Short Sleeve Graphic T-Shirt),https://d15udtvdbbfasl.cloudfront.net/catalog/product/large_image/00_419357.jpg,173
